{
  "$schema": "https://json-schema.org/draft/2020-12/schema",
  "$id": "https://nais.id/schema/nais-agents.json",
  "title": "NAIS Domain Agent Discovery",
  "description": "JSON Schema for the NAIS domain-level agent discovery document. Published at /.well-known/nais-agents.json, this file declares all agents associated with a domain and links to external partner agents.",
  "type": "object",
  "required": ["nais_version", "domain", "agents"],
  "additionalProperties": false,
  "properties": {
    "nais_version": {
      "type": "string",
      "description": "The NAIS protocol version for this discovery document.",
      "pattern": "^[0-9]+\\.[0-9]+$",
      "examples": ["1.1", "2.0"]
    },
    "domain": {
      "type": "string",
      "description": "The canonical domain that publishes this discovery document.",
      "minLength": 1,
      "examples": ["example.com", "mycompany.io"]
    },
    "default_agent": {
      "type": "string",
      "description": "The agent ID that should be used when no specific agent is requested. Must match an ID in the agents array.",
      "minLength": 1,
      "examples": ["support.example.com"]
    },
    "agents": {
      "type": "array",
      "description": "Local agents published by this domain.",
      "items": {
        "$ref": "#/$defs/AgentEntry"
      },
      "minItems": 1
    },
    "linked_agents": {
      "type": "array",
      "description": "External agents from other domains that this domain explicitly references or partners with.",
      "items": {
        "$ref": "#/$defs/LinkedAgentEntry"
      }
    },
    "metadata": {
      "type": "object",
      "description": "Optional domain-level metadata.",
      "additionalProperties": false,
      "properties": {
        "organization": {
          "type": "string",
          "description": "Organization or entity that operates this domain."
        },
        "contact": {
          "type": "string",
          "description": "Contact email or URL for the domain operator."
        },
        "updated_at": {
          "type": "string",
          "description": "ISO 8601 timestamp of the last update to this document.",
          "format": "date-time"
        }
      }
    }
  },
  "$defs": {
    "AgentEntry": {
      "type": "object",
      "description": "A local agent published by this domain.",
      "required": ["id", "name", "manifest_url"],
      "additionalProperties": false,
      "properties": {
        "id": {
          "type": "string",
          "description": "Unique agent identifier, typically a subdomain or scoped domain name.",
          "minLength": 1,
          "examples": ["support.example.com", "sales.example.com"]
        },
        "scope": {
          "type": "string",
          "description": "Agent scope. Always 'local' for agents in the agents array.",
          "enum": ["local"],
          "default": "local"
        },
        "name": {
          "type": "string",
          "description": "Human-readable display name for the agent.",
          "minLength": 1,
          "maxLength": 256
        },
        "description": {
          "type": "string",
          "description": "Brief description of what this agent does.",
          "maxLength": 4096
        },
        "manifest_url": {
          "type": "string",
          "description": "HTTPS URL to the agent's full NAIS manifest (agent.json).",
          "format": "uri",
          "pattern": "^https://"
        },
        "mcp_endpoint": {
          "type": "string",
          "description": "Optional shortcut to the agent's MCP endpoint.",
          "format": "uri"
        },
        "tags": {
          "type": "array",
          "description": "Categorization tags for this agent.",
          "items": {
            "type": "string"
          },
          "maxItems": 16,
          "uniqueItems": true
        },
        "status": {
          "type": "string",
          "description": "Operational status of the agent.",
          "enum": ["active", "beta", "deprecated", "maintenance"],
          "default": "active"
        }
      }
    },
    "LinkedAgentEntry": {
      "type": "object",
      "description": "An external agent from another domain that this domain references.",
      "required": ["id", "name"],
      "additionalProperties": false,
      "properties": {
        "id": {
          "type": "string",
          "description": "The external agent's domain identifier.",
          "minLength": 1,
          "examples": ["weatheragent.nais.id", "paymentbot.partner.com"]
        },
        "scope": {
          "type": "string",
          "description": "Agent scope. Always 'external' for linked agents.",
          "enum": ["external"],
          "default": "external"
        },
        "name": {
          "type": "string",
          "description": "Human-readable display name for the external agent.",
          "minLength": 1,
          "maxLength": 256
        },
        "description": {
          "type": "string",
          "description": "Brief description of the external agent's purpose in the context of this domain.",
          "maxLength": 4096
        },
        "manifest_url": {
          "type": "string",
          "description": "HTTPS URL to the external agent's NAIS manifest.",
          "format": "uri"
        },
        "relationship": {
          "type": "string",
          "description": "Nature of the relationship between this domain and the external agent.",
          "enum": ["partner", "provider", "affiliate", "fallback", "recommended"],
          "examples": ["partner", "provider"]
        },
        "verified": {
          "type": "boolean",
          "description": "Whether the domain operator has verified the external agent's identity.",
          "default": false
        },
        "tags": {
          "type": "array",
          "description": "Categorization tags for this linked agent.",
          "items": {
            "type": "string"
          },
          "maxItems": 16,
          "uniqueItems": true
        }
      }
    }
  }
}
